{"dominance_witness_sha256":"4ef73b366cc65d2efa1cb45c9a597c0c932ff122f9d2cb78279b7db975c2d4ad","format":"meta_core_proof_bundle_v1","schema_version":"1","statement_ids":["SOUNDNESS_BY_CONSTRUCTION_V1","TERMINATION_IR_TOTAL_V1","DOMINANCE_STRUCTURAL_OR_V1","STATE_MIGRATION_TOTAL_V1","SPEC_RUNTIME_HASH_BINDING_V1"]}
