{"dominance_witness_sha256":"ac5e97e5dde823c10a9369db4c0d42c8595e0c6286ce18aa7a9e1582807c4069","format":"meta_core_proof_bundle_v1","schema_version":"1","statement_ids":["SOUNDNESS_BY_CONSTRUCTION_V1","TERMINATION_IR_TOTAL_V1","DOMINANCE_STRUCTURAL_OR_V1","STATE_MIGRATION_TOTAL_V1","SPEC_RUNTIME_HASH_BINDING_V1"]}
