{"dominance_witness_sha256":"d61a578a29f61523f340a75e9bc8593edeba80e3d596ad0428958e507df2f0b8","format":"meta_core_proof_bundle_v1","schema_version":"1","statement_ids":["SOUNDNESS_BY_CONSTRUCTION_V1","TERMINATION_IR_TOTAL_V1","DOMINANCE_STRUCTURAL_OR_V1","STATE_MIGRATION_TOTAL_V1","SPEC_RUNTIME_HASH_BINDING_V1"]}
