{"dominance_witness_sha256":"53e35fb0eba26001061a6f4a9f44df42873175d7d0da39fbce7d186efdcd6288","format":"meta_core_proof_bundle_v1","schema_version":"1","statement_ids":["SOUNDNESS_BY_CONSTRUCTION_V1","TERMINATION_IR_TOTAL_V1","DOMINANCE_STRUCTURAL_OR_V1","STATE_MIGRATION_TOTAL_V1","SPEC_RUNTIME_HASH_BINDING_V1"]}
